ConanOBrien;2012-11-01 19:37;2066;840;Do you think after all these years the Romneys still laugh over Tagg, you're it?"";;;;264194452048973824;https://twitter.com/ConanOBrien/status/264194452048973824
ConanOBrien;2012-10-27 17:33;1752;578;The NFL Network's singing football is so cute! Oh wait that's Cee Lo.;;;;262351465958498304;https://twitter.com/ConanOBrien/status/262351465958498304
ConanOBrien;2012-10-26 10:25;972;696;The best perk of being a celebrity? I'm allowed to use 141 characters in my tweets. No, I don't feel like proving it.;;;;261881373831331840;https://twitter.com/ConanOBrien/status/261881373831331840
ConanOBrien;2012-10-23 09:55;3935;1290;A new sperm bank offers the sperm of athletes and rock stars. Finally, athletes and rock stars will be able to have illegitimate children.;;;;260786483798097920;https://twitter.com/ConanOBrien/status/260786483798097920
ConanOBrien;2012-10-22 13:09;1654;567;41% of adults are not working. And 11% of them are at this Best Buy right now, playing Madden '13.;;;;260472932239814656;https://twitter.com/ConanOBrien/status/260472932239814656
ConanOBrien;2012-10-17 20:51;3117;1021;The History Channel used to be cool, but they're just stuck in the past.;;;;258777328656711680;https://twitter.com/ConanOBrien/status/258777328656711680
ConanOBrien;2012-10-15 09:51;1428;588;I saw the time travel movie Looper. I saw it twice, the day it came out and when they rereleased it in 2044.;;;;257886442439725056;https://twitter.com/ConanOBrien/status/257886442439725056
ConanOBrien;2012-10-14 11:29;2676;674;Mitt Romney once invested in the Yankees. Which finally explains the time the Yankees tried to trade Alex Rodriguez to China.;;;;257548606775652352;https://twitter.com/ConanOBrien/status/257548606775652352
ConanOBrien;2012-10-10 14:15;1036;681;Hurrah! I am back in Ireland, 150 years after the British made me leave for doing a crappy talk show in the village.;;;;256140804383444993;https://twitter.com/ConanOBrien/status/256140804383444993
ConanOBrien;2012-10-06 10:32;1231;669;I’m in London right now. You won’t believe this, but there’s still a few minutes left in the Olympic closing ceremonies.;;;;254635301547425792;https://twitter.com/ConanOBrien/status/254635301547425792
ConanOBrien;2012-10-03 13:17;7156;1693;Romney prepped for tonight’s debate by debating with a man whose views differ radically from his own: himself from 8 years ago.;;;;253589726588715008;https://twitter.com/ConanOBrien/status/253589726588715008
ConanOBrien;2012-10-02 10:02;1312;519;If Ben & Jerry’s had been Jerry & Ben’s, I’m 100% certain that no one would buy their ice cream.;;;;253178036634144768;https://twitter.com/ConanOBrien/status/253178036634144768
ConanOBrien;2012-10-01 10:24;1314;506;I consider myself a 1-percenter since I’m in the 1 percent of people who saw both “Deuce Bigelow” movies.;;;;252821269693747201;https://twitter.com/ConanOBrien/status/252821269693747201
ConanOBrien;2012-09-30 11:32;1695;1047;“Goodness gracious, that is painful!” is what I should have yelled when I stubbed my toe in front of my kids.;;;;252475989878247424;https://twitter.com/ConanOBrien/status/252475989878247424
ConanOBrien;2012-09-28 17:52;1926;681;Starting a 3-day juice cleanse by dunking my cheeseburger in juice.;;;;251846995994628096;https://twitter.com/ConanOBrien/status/251846995994628096
ConanOBrien;2012-09-27 16:25;1177;904;I am sad to report that @Andy_Richter has…oops, false alarm, he’s up. Guess that was just a really long nap near a bloodstain.;;@Andy_Richter;;251462695390416896;https://twitter.com/ConanOBrien/status/251462695390416896
ConanOBrien;2012-09-22 11:39;3978;1017;Mitt Romney said his campaign is about the 100 percent." Then Romney said, "The 100% of the 53% who don't like the 47%."";;;;249578639283347456;https://twitter.com/ConanOBrien/status/249578639283347456
ConanOBrien;2012-09-19 14:18;3669;915;Now that all the publicity has died down, you can really find some great deals on Bath Salts.;;;;248531475778129920;https://twitter.com/ConanOBrien/status/248531475778129920
ConanOBrien;2012-09-18 15:47;1697;517;Lamborghini has announced a major recall of their cars. So, if you have a Lamborghini, please return it to your local rerun of Miami Vice.;;;;248191577405661185;https://twitter.com/ConanOBrien/status/248191577405661185
ConanOBrien;2012-09-16 14:19;7497;1149;Bold move by the NFL starting their season without their normal referees and going with guys from Foot Locker.;;;;247444641857802240;https://twitter.com/ConanOBrien/status/247444641857802240
ConanOBrien;2012-09-14 14:49;2119;588;Hooters restaurants have a new campaign aimed at attracting female customers. So far all they’ve come up with is “Lesbian Thursdays.”;;;;246727385540612097;https://twitter.com/ConanOBrien/status/246727385540612097
ConanOBrien;2012-09-13 18:49;3021;1079;Quick question: does anyone know if the “five second rule” also applies to liquids?;;;;246425372709752832;https://twitter.com/ConanOBrien/status/246425372709752832
ConanOBrien;2012-09-12 09:55;2940;839;Anyone who says you can’t judge a book by its cover hasn’t seen the cover of “The Big Book of Huge Breasts”.;;;;245928542272106497;https://twitter.com/ConanOBrien/status/245928542272106497
ConanOBrien;2012-09-09 13:40;4491;1788;Ben & Jerry’s is suing a porn company. I hate it when my two favorite things to binge on aren’t getting along.;;;;244898189742837763;https://twitter.com/ConanOBrien/status/244898189742837763
ConanOBrien;2012-09-07 14:51;1465;504;The gift bags from the MTV Video Music Awards included condoms and Hot Pockets. Let’s hope nobody confused the two.;;;;244191163681210368;https://twitter.com/ConanOBrien/status/244191163681210368
ConanOBrien;2012-09-04 15:08;2203;666;The Democrats are in Charlotte. Wouldn’t you know it, Bill Clinton showed up in the wrong Charlotte.;;;;243108421577097216;https://twitter.com/ConanOBrien/status/243108421577097216
ConanOBrien;2012-09-03 14:05;1584;590;I can’t wait for my kids to open their Labor Day presents. I gave them each an extra sick day for the upcoming fiscal quarter.;;;;242730171935911936;https://twitter.com/ConanOBrien/status/242730171935911936
ConanOBrien;2012-09-01 19:53;2803;770;Overheard some conservative Latino kids in a pool playing “Marco Rubio.”;;;;242092798617206784;https://twitter.com/ConanOBrien/status/242092798617206784
ConanOBrien;2012-08-31 13:35;1536;595;I know what it was like for Clint Eastwood. In my career, I’ve talked to more than a few “empty chairs.”;;;;241635402602143744;https://twitter.com/ConanOBrien/status/241635402602143744
ConanOBrien;2012-08-24 10:52;1987;1260;Just spared my 8 year old son years of teasing and a lifetime of therapy by buying him a BOY'S BIKE. Hear that, DAD? A BOY'S BIKE!!;;;;239057612367360001;https://twitter.com/ConanOBrien/status/239057612367360001
ConanOBrien;2012-08-23 12:54;3261;1228;I am so bored right now, I just yawned in the middle of a different yawn.;;;;238725819701284864;https://twitter.com/ConanOBrien/status/238725819701284864
ConanOBrien;2012-08-21 10:48;2499;751;How much wood would a woodchuck chuck if the price of wood made chucking prohibitively expensive?;;;;237969408700600320;https://twitter.com/ConanOBrien/status/237969408700600320
ConanOBrien;2012-08-19 13:22;5019;1741;Twitter is a nonstop series of pointless arguments by people I don’t care about. It's like Thanksgiving.;;;;237283425705394177;https://twitter.com/ConanOBrien/status/237283425705394177
ConanOBrien;2012-08-18 11:02;973;588;I’m pretty sure this on-hold music I’m listening to is a medley of “Satan’s Favorites”.;;;;236885785188659200;https://twitter.com/ConanOBrien/status/236885785188659200
ConanOBrien;2012-08-12 18:24;1207;567;Hey, auto industry! Why not develop a car that runs purely on my need for approval?;;;;234822700051361792;https://twitter.com/ConanOBrien/status/234822700051361792
ConanOBrien;2012-08-09 16:44;1050;472;It was 100 degrees today. I haven’t seen 3 digits since I visited my old shop teacher.;;;;233710398002569216;https://twitter.com/ConanOBrien/status/233710398002569216
ConanOBrien;2012-08-06 09:41;4995;1385;I’m going to go out on a limb and say Americans should be free to marry any chicken sandwich they choose.;;;;232516726879838208;https://twitter.com/ConanOBrien/status/232516726879838208
ConanOBrien;2012-08-05 10:43;1981;707;Other than candy, ice cream, honey, sugar, and sugar substitutes, is there anything sweeter than the love of your family?;;;;232169968215678976;https://twitter.com/ConanOBrien/status/232169968215678976
ConanOBrien;2012-08-04 13:50;17425;3508;This Chick-fil-A scandal has got me worried. I want to go to Arby’s but I don’t know where they stand on the unrest in Syria.;;;;231854696728522752;https://twitter.com/ConanOBrien/status/231854696728522752
ConanOBrien;2012-07-28 13:25;1936;521;I predict 350 lb. weight lifter Holley Mangold will bring home the gold and 4 guys against their will.;;;;229311698316701696;https://twitter.com/ConanOBrien/status/229311698316701696
ConanOBrien;2012-07-27 20:27;3665;1040;The opening ceremonies have won me over. Any show that combines pyrotechnics, top hats, The Beatles and sheep is okay in my book.;;;;229055443421499392;https://twitter.com/ConanOBrien/status/229055443421499392
ConanOBrien;2012-07-27 19:58;2870;912;Watching London’s opening ceremonies. Hard to believe my ancestors were conquered by theirs.;;;;229048194770808834;https://twitter.com/ConanOBrien/status/229048194770808834
ConanOBrien;2012-07-27 10:36;5278;1134;Mitt Romney is at the Olympics. Mitt said he loves watching people from other countries work for no money.;;;;228906689036955648;https://twitter.com/ConanOBrien/status/228906689036955648
ConanOBrien;2012-07-26 19:54;9219;1509;It’s hard to believe that the greatest division in American politics these days is “pro-“ or “anti-Chick-fil-A.”;;;;228684822317510656;https://twitter.com/ConanOBrien/status/228684822317510656
ConanOBrien;2012-07-25 22:09;2991;799;It’s reported that Kim Jong-un got married. He’s registered at the local, “Bed, Bath and Other Things They Don’t Have in North Korea.”;;;;228356333714419712;https://twitter.com/ConanOBrien/status/228356333714419712
ConanOBrien;2012-07-18 09:10;1188;525;Look for me on next week’s episode of Breaking Bad. I play a beaker of thorium oxide.;;;;225623587090993152;https://twitter.com/ConanOBrien/status/225623587090993152
ConanOBrien;2012-07-17 09:03;2199;567;I suspected the U.S. Olympics team uniforms were made in China when I noticed the pants didn’t have a cup holder.;;;;225259561144156160;https://twitter.com/ConanOBrien/status/225259561144156160
ConanOBrien;2012-07-16 07:34;2604;822;It’s so dangerous to hitchhike. Just ask the guy I buried in the desert.;;;;224874667515719680;https://twitter.com/ConanOBrien/status/224874667515719680
ConanOBrien;2012-07-14 11:31;3524;966;It's quiet today in LA. Reminds me of the day the Kings won the Stanley Cup.;;;;224209548846710785;https://twitter.com/ConanOBrien/status/224209548846710785
ConanOBrien;2012-07-11 08:02;2642;631;We can all help cure our dependence on foreign oil by becoming depressed and sleeping most of the day.;;;;223069833930096640;https://twitter.com/ConanOBrien/status/223069833930096640
ConanOBrien;2012-07-10 06:47;2062;563;Money doesn’t grow on trees. Your move, multinational agricultural biotechnology corporations.;;;;222688604982476800;https://twitter.com/ConanOBrien/status/222688604982476800
ConanOBrien;2012-07-04 09:09;3979;1340;Just found out the wife is writing a book about our honeymoon, called “50 Shades of Just O.K.”;;;;220549899962421250;https://twitter.com/ConanOBrien/status/220549899962421250
ConanOBrien;2012-07-02 08:47;2142;490;Can’t decide whether to join Chris Brown and Drake’s entourage. Which one offers dental?;;;;219819681085796353;https://twitter.com/ConanOBrien/status/219819681085796353
ConanOBrien;2012-06-30 11:02;1573;577;Justin Bieber’s new album is not selling as well as expected. Think how bad it would be doing if I hadn’t bought 50,000 copies.;;;;219128807737667587;https://twitter.com/ConanOBrien/status/219128807737667587
ConanOBrien;2012-06-26 10:47;2216;598;Katy Perry’s starting her own record label. It will be the first one that releases both CDs and C-DDs.;;;;217675406613032960;https://twitter.com/ConanOBrien/status/217675406613032960
ConanOBrien;2012-06-25 18:58;3496;747;. @MittRomney ’s trying so hard to connect with the Latino community, today he had himself deported.;;@MittRomney;;217436599699517440;https://twitter.com/ConanOBrien/status/217436599699517440
ConanOBrien;2012-06-24 12:09;1078;380;Family back east dealing with heat wave the old-fashioned way: resenting it until it goes away.;;;;216971264055705600;https://twitter.com/ConanOBrien/status/216971264055705600
ConanOBrien;2012-06-22 10:42;2208;1139;My wife can always tell I'm lying because I break down in tears and scream, I'm lying!"";;;;216224779894669313;https://twitter.com/ConanOBrien/status/216224779894669313
ConanOBrien;2012-06-20 21:13;1641;607;. @MittRomney - Had your sons on #Conan tonight. After they left, I found $20,000 in the couch cushions.;;@MittRomney;#Conan;215658608464113665;https://twitter.com/ConanOBrien/status/215658608464113665
ConanOBrien;2012-06-19 09:32;2633;356;The @RedSox are in last place. The @Nationals are in first. I'm ready for you, locusts.;;@RedSox @Nationals;;215119805433397248;https://twitter.com/ConanOBrien/status/215119805433397248
ConanOBrien;2012-06-17 21:50;4917;1291;Just saw Luke Skywalker take Darth Vader to The Sizzler for Father's Day. They seemed tense.;;;;214580774270275584;https://twitter.com/ConanOBrien/status/214580774270275584
ConanOBrien;2012-06-08 16:19;1717;484;How many baby carrots offset five adult cupcakes?;;;;211235942030254080;https://twitter.com/ConanOBrien/status/211235942030254080
ConanOBrien;2012-06-06 13:46;4284;2007;None of the new interns are ticklish, so that was awkward.;;;;210472652916269056;https://twitter.com/ConanOBrien/status/210472652916269056
ConanOBrien;2012-05-31 08:20;2001;538;Apple says they’re coming out with a big announcement. Hope it’s not about the internet history on my Macbook Pro. #EroticWeatherChannel;;;#EroticWeatherChannel;208216297698361344;https://twitter.com/ConanOBrien/status/208216297698361344
ConanOBrien;2012-05-30 07:04;4429;1193;Taking a DNA test just to make sure I’m not a Kardashian.;;;;207834875124908035;https://twitter.com/ConanOBrien/status/207834875124908035
ConanOBrien;2012-05-28 06:39;3385;638;There was a tropical storm named “Bud?” I assume it’s the first one to threaten the coast wearing a wife beater.;;;;207103781228384257;https://twitter.com/ConanOBrien/status/207103781228384257
ConanOBrien;2012-05-27 12:02;2811;747;I might be watching too much “Game of Thrones” because I won’t eat shrimp without first subjecting them to a loud, public beheading.;;;;206822801603178496;https://twitter.com/ConanOBrien/status/206822801603178496
ConanOBrien;2012-05-24 09:21;10343;1922;This morning I thought I heard a neighbor blasting that new @Skrillex song I like, but then I realized it was just the garbage truck.;;@Skrillex;;205694913675927553;https://twitter.com/ConanOBrien/status/205694913675927553
ConanOBrien;2012-05-23 09:44;2061;494;I’m sure the guys Mitt Romney bullied in high school take comfort in knowing he’s now a famous billionaire.;;;;205338370363240448;https://twitter.com/ConanOBrien/status/205338370363240448
ConanOBrien;2012-05-19 10:03;2339;825;They say “opposites attract” and yet I don’t have the hots for the Tanning Mom.;;;;203893769291046912;https://twitter.com/ConanOBrien/status/203893769291046912
ConanOBrien;2012-05-17 06:10;1510;540;Going on Letterman tonight for the first time in 13 years. Dave wanted to wait until I hit puberty.;;;;203110356212645888;https://twitter.com/ConanOBrien/status/203110356212645888
ConanOBrien;2012-05-16 11:18;5482;1146;. @Snooki is considering filming her childbirth, on the off chance there’s someone out there who hasn’t seen her vagina yet.;;@Snooki;;202825401385484288;https://twitter.com/ConanOBrien/status/202825401385484288
ConanOBrien;2012-05-15 17:16;1924;698;If Obama's the first gay president, then I'm the first gay late night host! Oh, he's not gay? Then I was being sarcastic.;;;;202553039440195584;https://twitter.com/ConanOBrien/status/202553039440195584
ConanOBrien;2012-05-14 11:21;3829;770;You know who’s behind this big push for gay marriage? The immensely powerful tuxedo industry.;;;;202101314560327680;https://twitter.com/ConanOBrien/status/202101314560327680
ConanOBrien;2012-05-13 09:51;1767;300;Instead of flowers, I sent my Mom an assortment of unsecured Greek Treasury bonds.;;;;201716200378597376;https://twitter.com/ConanOBrien/status/201716200378597376
ConanOBrien;2012-05-12 15:36;1475;404;I’m just like the Hulk, except when I’m mad, I get dry mouth.;;;;201440786087292928;https://twitter.com/ConanOBrien/status/201440786087292928
ConanOBrien;2012-05-10 10:13;1809;421;Just heard someone logging onto AOL. Instead of “You’ve Got Mail” the voice now says, “Greetings, Old Fool!”;;;;200634618901299201;https://twitter.com/ConanOBrien/status/200634618901299201
ConanOBrien;2012-05-09 09:49;1582;267;This baseball season has an upside: my son gets to see the Red Sox I grew up with!;;;;200266331961040897;https://twitter.com/ConanOBrien/status/200266331961040897
ConanOBrien;2012-05-08 10:17;7191;1667;I went to see “The Avengers” today and it was sold out. I looked like an idiot dressed like the Hulk during a showing of “Think Like a Man.”;;;;199910940114829312;https://twitter.com/ConanOBrien/status/199910940114829312
ConanOBrien;2012-05-05 10:26;1413;476;Ever get really into playing a video game, only to discover it was just one of those high-tech Japanese toilets?;;;;198826061264470016;https://twitter.com/ConanOBrien/status/198826061264470016
ConanOBrien;2012-05-01 14:43;1563;685;People always ask me: “WHY?! OH GOD WHY?!!?” Mostly at the beach.;;;;197441095238565890;https://twitter.com/ConanOBrien/status/197441095238565890
ConanOBrien;2012-04-29 14:11;1684;595;Fool me once, shame on my personal fool-stopper, Reginald.;;;;196708187024539648;https://twitter.com/ConanOBrien/status/196708187024539648
ConanOBrien;2012-04-25 10:18;2457;954;I looked in the bathroom mirror this morning and saw my Dad looking back at me. We should stop taking baths together.;;;;195200070507954179;https://twitter.com/ConanOBrien/status/195200070507954179
ConanOBrien;2012-04-24 11:15;1788;366;Take a moment to thank the veterans of our many Storage Wars.;;;;194852179297841152;https://twitter.com/ConanOBrien/status/194852179297841152
ConanOBrien;2012-04-22 12:04;5043;1304;Why are people so impressed by wine cellars but so saddened by my Jagermeister crawlspace?;;;;194139726419206145;https://twitter.com/ConanOBrien/status/194139726419206145
ConanOBrien;2012-04-21 11:41;1040;325;Just heard the craziest recording of Mel Gibson speaking in calm and measured tones.;;;;193771554788741125;https://twitter.com/ConanOBrien/status/193771554788741125
ConanOBrien;2012-04-19 08:28;1313;355;I saw Rick Santorum on the news today. He was making sure a pregnant pause reached full term.;;;;192998195608043520;https://twitter.com/ConanOBrien/status/192998195608043520
ConanOBrien;2012-04-16 08:59;1362;338;Looks like I’m getting back one chicken leg and 4 golden Sacagawea coins. I probably shouldn’t do my own taxes.;;;;191918640470302720;https://twitter.com/ConanOBrien/status/191918640470302720
ConanOBrien;2012-04-13 09:33;1633;436;Tax question: Is it technically considered cheating if you claim your 5.4 million Twitter followers as dependents?;;;;190840207707340800;https://twitter.com/ConanOBrien/status/190840207707340800
ConanOBrien;2012-04-12 10:01;1596;491;Actually both. That IS a tube of Chapstick in my pocket AND I'm glad to see you.;;;;190484831631716353;https://twitter.com/ConanOBrien/status/190484831631716353
ConanOBrien;2012-04-11 10:24;2233;379;There are two kinds of Mexican restaurants. Those that serve fresh authentic cuisine, and ones that serve the cheap, greasy junk I love.;;;;190128298335019008;https://twitter.com/ConanOBrien/status/190128298335019008
ConanOBrien;2012-04-09 08:01;3002;765;President @BarackObama claims to be a Trekkie. But where’s the proof? Why won’t he release his fan fiction?;;@BarackObama;;189367384920952832;https://twitter.com/ConanOBrien/status/189367384920952832
ConanOBrien;2012-04-08 13:08;2489;542;My mother used to hide the eggs in the same place every Easter... the dairy section of our local supermarket.;;;;189082233653571586;https://twitter.com/ConanOBrien/status/189082233653571586
ConanOBrien;2012-04-06 07:50;4619;1520;Just saw a lame white guy lip-synching a Jay-Z song as I drove past the mirror store.;;;;188277430123888640;https://twitter.com/ConanOBrien/status/188277430123888640
ConanOBrien;2012-04-05 07:56;2415;534;They can see every man's bald spot and down every woman's blouse. THAT'S why giraffes are always smirking.;;;;187916632583180290;https://twitter.com/ConanOBrien/status/187916632583180290
ConanOBrien;2012-03-27 09:40;2310;388;Bear Grylls' survival show got canceled last week. Something tells me he's going to make it through this just fine.;;;;184681210180673536;https://twitter.com/ConanOBrien/status/184681210180673536
ConanOBrien;2012-03-26 09:20;1592;510;Got my oil changed downtown just so I could tweet something that sounded dirty.;;;;184313867080445952;https://twitter.com/ConanOBrien/status/184313867080445952
ConanOBrien;2012-03-25 12:56;1101;413;How embarrassing. My son opened a box labeled Daddy's Things - Private" and found all my Styx cassettes.";;;;184005884916154368;https://twitter.com/ConanOBrien/status/184005884916154368
ConanOBrien;2012-03-23 09:33;2779;370;Anyone else worried that we're in the midst of a cupcake store bubble?;;;;183229872464867329;https://twitter.com/ConanOBrien/status/183229872464867329
ConanOBrien;2012-03-20 11:06;3764;862;I finally saw Drive. Man, it really captures that awkwardness of when the girl you’re courting watches you kill a henchman on an elevator.;;;;182166165316042752;https://twitter.com/ConanOBrien/status/182166165316042752
ConanOBrien;2012-03-19 09:23;2133;773;At some point, I’m going to have to tell my kids they’re not adopted. They’ll be crushed.;;;;181777956203536385;https://twitter.com/ConanOBrien/status/181777956203536385
ConanOBrien;2012-03-18 08:23;6749;1172;Hey guys, I’m starting a cool new hashtag: #tweetmeyoursocialsecuritynumber;;;#tweetmeyoursocialsecuritynumber;181400324190388224;https://twitter.com/ConanOBrien/status/181400324190388224
ConanOBrien;2012-03-15 10:27;2601;498;When they finally found Carmen Sandiego, her bones were scattered in a coyote den.;;;;180344525154299904;https://twitter.com/ConanOBrien/status/180344525154299904
ConanOBrien;2012-03-12 10:26;2484;391;Michigan State has a new course on surviving a zombie apocalypse. I think it’s a trap because the prerequisites are English 101 & Brrrains.;;;;179257189238710272;https://twitter.com/ConanOBrien/status/179257189238710272
ConanOBrien;2012-03-10 06:16;2663;472;It’s being reported that the richest man in the world right now is a Mexican billionaire. His name? Mitt Romniguez.;;;;178484478761631744;https://twitter.com/ConanOBrien/status/178484478761631744
ConanOBrien;2012-03-09 10:14;3346;556;I found the iPad 3 announcement especially disappointing because I’m still standing in line for my iPad 2.;;;;178181944360701952;https://twitter.com/ConanOBrien/status/178181944360701952
ConanOBrien;2012-03-06 09:32;2336;380;I've been practicing for this year's St. Patrick's Day. Every morning, I have my personal trainer punch me in the face.;;;;177084223742672897;https://twitter.com/ConanOBrien/status/177084223742672897
ConanOBrien;2012-03-05 19:11;2372;415;Ever notice that you never see The Lorax and Wilford Brimley in the same room together? #AdmitItWilford;;;#AdmitItWilford;176867624322465792;https://twitter.com/ConanOBrien/status/176867624322465792
ConanOBrien;2012-03-04 11:18;7446;1537;I start every morning with a simple affirmation: I will not murder anyone today.;;;;176386173269311488;https://twitter.com/ConanOBrien/status/176386173269311488
ConanOBrien;2012-03-03 13:28;1732;488;The Civil War reenactments are a little different here in LA. Larry King is always on hand yelling, “It wasn’t like that.”;;;;176056524798566401;https://twitter.com/ConanOBrien/status/176056524798566401
ConanOBrien;2012-03-02 11:18;1840;525;I would gladly trade all my fame and fortune for even more fame and fortune.;;;;175661400042123264;https://twitter.com/ConanOBrien/status/175661400042123264
ConanOBrien;2012-03-01 09:54;1503;411;I wonder if my car's blind spot compensates with a heightened sense of touch and smell.;;;;175277919655034880;https://twitter.com/ConanOBrien/status/175277919655034880
ConanOBrien;2012-02-26 10:55;2908;471;Just saw a Jeremy Lin jersey on sale for $300. These prices are Jeremy insane! Wait… Did I do that wrong?;;;;173843525597802498;https://twitter.com/ConanOBrien/status/173843525597802498
ConanOBrien;2012-02-25 11:44;2574;735;Today I’m gonna get high and see if the Nixon tapes sync up to Pink Floyd.;;;;173493503928713217;https://twitter.com/ConanOBrien/status/173493503928713217
ConanOBrien;2012-02-24 10:18;3916;951;“Fine, sure, go ahead. Weird, but I like it.” (God greenlighting the Armadillo);;;;173109593050853378;https://twitter.com/ConanOBrien/status/173109593050853378
ConanOBrien;2012-02-22 09:46;1786;353;If Meryl Streep is really such a great actress, why won’t she play the lead in my new movie, “The Tupac Shakur Story”?;;;;172376740658810880;https://twitter.com/ConanOBrien/status/172376740658810880
