ConanOBrien;2014-06-07 16:47;1953;2937;I’m a committed vegan, but only between meals.;;;;475423916232429568;https://twitter.com/ConanOBrien/status/475423916232429568
ConanOBrien;2014-06-05 17:48;2751;2053;According to a new study, narcissists use Twitter the most. Please RT.;;;;474714497756561409;https://twitter.com/ConanOBrien/status/474714497756561409
ConanOBrien;2014-06-02 09:06;3054;3593;Game of Thrones Spoiler Alert: Last night's episode contained violence and some nudity.;;;;473495855753097216;https://twitter.com/ConanOBrien/status/473495855753097216
ConanOBrien;2014-05-30 20:37;2007;3144;Trying to come up with a metaphor for the pointlessness of life, but this hamster in a wheel is distracting me.;;;;472582531326287872;https://twitter.com/ConanOBrien/status/472582531326287872
ConanOBrien;2014-05-11 12:37;1091;2902;For Mother’s Day I’m giving my wife the one thing she wants from me: space.;;;;465576553330790400;https://twitter.com/ConanOBrien/status/465576553330790400
ConanOBrien;2014-05-02 22:17;3649;4679;April showers bring May flowers and Mayflowers bring small pox.;;;;462460826784251904;https://twitter.com/ConanOBrien/status/462460826784251904
ConanOBrien;2014-04-29 18:53;3216;4788;Just saw a guy driving a Tesla while wearing Google Glass and blaring Daft Punk. Now THAT’S how you overcompensate.;;;;461322525809446912;https://twitter.com/ConanOBrien/status/461322525809446912
ConanOBrien;2014-04-28 10:49;2090;2743;I know it's early in the season, but so far my Game of Thrones murder bracket" is intact.";;;;460838316598767617;https://twitter.com/ConanOBrien/status/460838316598767617
ConanOBrien;2014-04-24 21:21;2656;4644;Just benched 300 (sat on a bench, watched 300").";;;;459547627986493440;https://twitter.com/ConanOBrien/status/459547627986493440
ConanOBrien;2014-04-23 10:41;1566;2281;Saturn just gave birth to a moon. I'm pretty sure she¹s not a single parent, because she has a ring.;;;;459024247180886016;https://twitter.com/ConanOBrien/status/459024247180886016
ConanOBrien;2014-04-22 18:10;3701;5094;Let¹s face it, anyone named Captain America should be overweight and have a porn addiction.;;;;458774974031863809;https://twitter.com/ConanOBrien/status/458774974031863809
ConanOBrien;2014-04-21 12:06;1453;2769;Camped out at CVS so I can beat the rush for half-priced Peeps.;;;;458320995250499585;https://twitter.com/ConanOBrien/status/458320995250499585
ConanOBrien;2014-04-20 12:01;888;1711;Who painted these Easter eggs? BANKSY!!!;;;;457957342357647362;https://twitter.com/ConanOBrien/status/457957342357647362
ConanOBrien;2014-04-19 19:29;5589;8941;Babies are being named after Game of Thrones" characters?  What parents would name a baby after a sword wielding, mythological character?";;;;457707578235969536;https://twitter.com/ConanOBrien/status/457707578235969536
ConanOBrien;2014-04-17 16:28;1091;1911;Just found out that you can lead a horse to water, but you can't make him look at alarming statistics about beach erosion.;;;;456937376896385024;https://twitter.com/ConanOBrien/status/456937376896385024
ConanOBrien;2014-04-13 19:47;645;2447;I've spent a good chunk of the @MTV #MovieAwards inside this flaming popcorn. I'm now 7% butter. pic.twitter.com/uQwsuB16zf;;@MTV;#MovieAwards;455537850272870400;https://twitter.com/ConanOBrien/status/455537850272870400
ConanOBrien;2014-04-13 18:53;389;1344;Tonight the stage is actually on fire at the @MTV #MovieAwards . FYI I'm cooking a lamb shank over the I" in "MOVIE." pic.twitter.com/MzGdxRW3pL";;@MTV;#MovieAwards;455524202640977920;https://twitter.com/ConanOBrien/status/455524202640977920
ConanOBrien;2014-04-13 14:24;2095;4248;As host of the @MTV #MovieAwards tonight, I pledge to stay completely impartial. pic.twitter.com/jjBQWsW46l;;@MTV;#MovieAwards;455456506696048640;https://twitter.com/ConanOBrien/status/455456506696048640
ConanOBrien;2014-04-12 18:21;1965;4813;My name is Conan and... I'm into Thor cosplay. @MTV #MovieAwards pic.twitter.com/jVMCAOmdOo;;@MTV;#MovieAwards;455153690412732416;https://twitter.com/ConanOBrien/status/455153690412732416
ConanOBrien;2014-04-11 23:03;1080;3254;Just finished watching the most emotionally powerful film of the year. #MovieAwards pic.twitter.com/CESijgNFAs;;;#MovieAwards;454862230400421888;https://twitter.com/ConanOBrien/status/454862230400421888
ConanOBrien;2014-04-07 22:08;2333;4727;Great acting in Noah."  Giraffe #2 was incredible.";;;#2;453399036821643265;https://twitter.com/ConanOBrien/status/453399036821643265
ConanOBrien;2014-04-04 21:13;1494;3454;Texas: Thanks for a great week of shows and food. I haven't had that much meat inside of me since that one experimental night in college.;;;;452298055123869696;https://twitter.com/ConanOBrien/status/452298055123869696
ConanOBrien;2014-03-29 16:37;3384;6302;Everything’s bigger in Texas, so while I’m here I’m updating my dick pics.;;;;450054237079101440;https://twitter.com/ConanOBrien/status/450054237079101440
ConanOBrien;2014-03-26 14:12;1128;1453;Quiznos filed for bankruptcy protection? So where are all the people who never ate there not going to eat?;;;;448930603509886976;https://twitter.com/ConanOBrien/status/448930603509886976
ConanOBrien;2014-03-24 10:14;955;1551;I’m worried that “Captain America: The Winter Soldier” is just going to be 2 hours of him posting Polar Vortex photos on his Facebook page.;;;;448145721510748160;https://twitter.com/ConanOBrien/status/448145721510748160
ConanOBrien;2014-03-18 20:25;1793;2901;Just Googled 47 products I would never buy, just to see how fast ads for them pop up on my Facebook page.;;;;446125221473308672;https://twitter.com/ConanOBrien/status/446125221473308672
ConanOBrien;2014-03-17 06:54;4328;4063;Terrible climate, centuries of oppression, and the gene for alcoholism. Or as I call it, “The luck of the Irish.”;;;;445558717497352194;https://twitter.com/ConanOBrien/status/445558717497352194
ConanOBrien;2014-03-16 20:49;1500;2422;Everybody is Irish on St. Patrick’s Day, which must make it a living hell for Irish Immigration officials.;;;;445406428719628288;https://twitter.com/ConanOBrien/status/445406428719628288
ConanOBrien;2014-03-15 11:05;3003;3076;Do you think Putin just misunderstood the term “March Madness”?;;;;444897200242319360;https://twitter.com/ConanOBrien/status/444897200242319360
ConanOBrien;2014-03-12 10:56;2684;2881;Forbes released the list of the richest billionaires. Kinda makes you feel bad for the poorest billionaires.;;;;443807811609182209;https://twitter.com/ConanOBrien/status/443807811609182209
ConanOBrien;2014-03-06 18:03;2104;4089;My son asked me what happens when you die, and I said, “I’m watching Chopped, just google it.”;;;;441756043211571201;https://twitter.com/ConanOBrien/status/441756043211571201
ConanOBrien;2014-03-05 07:00;877;2009;I'm excited to host the MTV #MovieAwards on 4/13! I was going to say no, but @Harry_Styles begged me. Please don't ask him to confirm this.;;@Harry_Styles;#MovieAwards;441226715923111937;https://twitter.com/ConanOBrien/status/441226715923111937
ConanOBrien;2014-03-03 20:08;3555;5038;I just found out my autocorrect has been programmed by John Travolta.;;;;440700263364456448;https://twitter.com/ConanOBrien/status/440700263364456448
ConanOBrien;2014-03-01 11:48;1339;3723;My guests next week are James Spader, Bill Hader, Ralph Nader, and Darth Vader.;;;;439849615425155072;https://twitter.com/ConanOBrien/status/439849615425155072
ConanOBrien;2014-02-26 00:13;1512;3044;I find all my best babysitters on Tinder.;;;;438587737151508480;https://twitter.com/ConanOBrien/status/438587737151508480
ConanOBrien;2014-02-24 12:58;4064;4388;Just once in my life, I’d like to know the sweet satisfaction of finishing a tube of ChapStick.;;;;438055443630276608;https://twitter.com/ConanOBrien/status/438055443630276608
ConanOBrien;2014-02-23 14:43;982;3308;Whenever my children call me Father," I feel like I'm about to be murdered, in black and white.";;;;437719435940360192;https://twitter.com/ConanOBrien/status/437719435940360192
ConanOBrien;2014-02-22 16:21;2620;4374;Just took one of those “Which Movie Character Are You?” quizzes and found out I’m the plastic bag from American Beauty.;;;;437381741406220288;https://twitter.com/ConanOBrien/status/437381741406220288
ConanOBrien;2014-02-20 15:20;2321;2483;A new study shows on average, men’s brains are larger than women’s. But the extra space is filled entirely with barbecue sauce.;;;;436641583434174464;https://twitter.com/ConanOBrien/status/436641583434174464
ConanOBrien;2014-02-17 12:26;507;2696;. @sethmeyers That's not a janitor's closet, that was my dressing room.;;@sethmeyers;;435510691177308160;https://twitter.com/ConanOBrien/status/435510691177308160
ConanOBrien;2014-02-17 07:30;3711;8393;As the only man alive who’s hosted The Tonight Show & Late Night, I want to congratulate @JimmyFallon & @SethMeyers . They’ll both do great!;;@JimmyFallon @SethMeyers;;435436027914633219;https://twitter.com/ConanOBrien/status/435436027914633219
ConanOBrien;2014-02-16 20:42;3356;4263;Wow. Strippers get angry if you make it rain Bitcoins.;;;;435273030927802368;https://twitter.com/ConanOBrien/status/435273030927802368
ConanOBrien;2014-02-14 11:42;5104;4140;A survey found that, on Valentine’s Day, men spend $87.00 more than women. I.e., a survey found that, on Valentine’s Day, men spend $87.00.;;;;434412389534924800;https://twitter.com/ConanOBrien/status/434412389534924800
ConanOBrien;2014-02-11 18:22;5457;6730;I just found out the “L” in Samuel L. Jackson stands for Laurence Fishburne.;;;;433425863653085184;https://twitter.com/ConanOBrien/status/433425863653085184
ConanOBrien;2014-02-09 09:33;4547;4564;Americans now read Facebook more than the Bible. I guess nobody wants to read about a guy who could only come up with 12 friends.;;;;432567839497531392;https://twitter.com/ConanOBrien/status/432567839497531392
ConanOBrien;2014-02-04 10:44;1269;1814;Just read a study claiming dogs can feel love, which is yet another way dogs are superior to cats. And comedians.;;;;430773855351627776;https://twitter.com/ConanOBrien/status/430773855351627776
ConanOBrien;2014-02-03 12:55;7085;8217;After seeing that commercial with the horse & puppy, my kids wouldn’t stop bugging me. So I caved and bought them a case of Bud.;;;;430444558569046016;https://twitter.com/ConanOBrien/status/430444558569046016
ConanOBrien;2014-01-31 12:09;1745;2387;A bridal shop is now using female mannequins that have back fat. They’re right next to the male mannequins that have second thoughts.;;;;429345762569248768;https://twitter.com/ConanOBrien/status/429345762569248768
ConanOBrien;2014-01-30 13:23;3338;3220;Queen Elizabeth is in financial trouble. How do you go broke when your face is on the money?;;;;429001971345793024;https://twitter.com/ConanOBrien/status/429001971345793024
ConanOBrien;2014-01-26 15:25;973;2282;I hate the Paparazzi, always photographing me when I’m with my family or searching through Nick Jonas’ trash.;;;;427583203675627520;https://twitter.com/ConanOBrien/status/427583203675627520
ConanOBrien;2014-01-24 15:52;1290;1549;Just read part of an incredible synopsis of an article about Attention Deficit something or other.;;;;426865115414020096;https://twitter.com/ConanOBrien/status/426865115414020096
ConanOBrien;2014-01-21 11:45;2181;2924;When someone calls me pretentious, the white gloves come off.;;;;425715885618110464;https://twitter.com/ConanOBrien/status/425715885618110464
ConanOBrien;2014-01-19 12:32;2407;2123;Did you know the Broncos have an entire coaching unit solely dedicated to containing Tom Brady’s handsomeness?;;;;425002938352689152;https://twitter.com/ConanOBrien/status/425002938352689152
ConanOBrien;2014-01-18 18:15;2217;3012;When the phone rings at Meryl Streep’s house, do you think she says, “Don’t answer it, it’s just another one of those Oscar nominations”?;;;;424726840528207873;https://twitter.com/ConanOBrien/status/424726840528207873
ConanOBrien;2014-01-14 12:38;900;1772;A kid in New Jersey is falsely claiming to be my illegitimate son. For the record, I have three children: Neve, Beckett, and @RonanFarrow .;;@RonanFarrow;;423192462195060736;https://twitter.com/ConanOBrien/status/423192462195060736
ConanOBrien;2014-01-14 12:11;2111;2710;Last night, I was reading “Bridge to Terabithia” to my kids when Chris Christie showed up and shut it down.;;;;423185729515028480;https://twitter.com/ConanOBrien/status/423185729515028480
ConanOBrien;2014-01-12 15:04;2253;2534;Don’t hate the playa, unless he’s playing lacrosse.;;;;422504372858146817;https://twitter.com/ConanOBrien/status/422504372858146817
ConanOBrien;2014-01-11 11:31;1451;1649;Fox News is starting a channel for children. It’s going to call President Obama a “Socialist Kenyan Muslim With Cooties.”;;;;422088271552720896;https://twitter.com/ConanOBrien/status/422088271552720896
ConanOBrien;2014-01-10 13:06;3389;2717;Kim Jong Un & Nicolas Cage have birthdays this week. So happy birthday to a madman unleashing terrible things on the world, and Kim Jong Un.;;;;421749860669198336;https://twitter.com/ConanOBrien/status/421749860669198336
ConanOBrien;2014-01-08 20:24;4014;6544;When I’m in Colorado, ladies, it’s not just Mountain Time, it’s mountin’ time. My God, how do I delete this tweet?;;;;421135242594758656;https://twitter.com/ConanOBrien/status/421135242594758656
ConanOBrien;2014-01-04 20:19;1471;1836;FUN FACT: Each new member of One Direction is grown humanely at Direction Labs facilities, using only the finest polymer-based additives.;;;;419684543289769984;https://twitter.com/ConanOBrien/status/419684543289769984
ConanOBrien;2014-01-03 15:55;3220;5249;I’ve already broken my New Year’s Resolution to not camp out on Jennifer Lawrence’s driveway.;;;;419255757758930944;https://twitter.com/ConanOBrien/status/419255757758930944
ConanOBrien;2013-12-31 17:49;2830;2806;New Year’s Eve is just a made up holiday created by the taxi industry to get more vomit in cars.;;;;418197284321361920;https://twitter.com/ConanOBrien/status/418197284321361920
ConanOBrien;2013-12-30 10:51;2062;4302;Friends are asking about my New Year’s plans, but drinking off-brand gin & browsing http:// LaneBryant.com isn’t really something you plan.;;;;417729680699949056;https://twitter.com/ConanOBrien/status/417729680699949056
ConanOBrien;2013-12-29 15:23;1496;3780;I consider 2013 a pretty good year for me because I didn’t appear in any pistachio commercials.;;;;417435826335645696;https://twitter.com/ConanOBrien/status/417435826335645696
ConanOBrien;2013-12-24 11:49;2483;2436;There’s nothing like the look of wonder on a child’s face on Christmas morning when he doesn’t get anything.;;;;415569959616393216;https://twitter.com/ConanOBrien/status/415569959616393216
ConanOBrien;2013-12-18 16:05;6940;5220;Gift cards: the best way to say “Here. You figure it out.”;;;;413459998388142080;https://twitter.com/ConanOBrien/status/413459998388142080
ConanOBrien;2013-12-14 20:46;1070;1127;Photo Christmas cards: making husbands ask “Who are these people again?” since they were invented.;;;;412081206637764608;https://twitter.com/ConanOBrien/status/412081206637764608
ConanOBrien;2013-12-13 13:59;1550;2993;This Christmas, I am giving everyone on my staff three seconds of eye contact.;;;;411616316332589056;https://twitter.com/ConanOBrien/status/411616316332589056
ConanOBrien;2013-12-10 21:14;1424;1534;I’m always happy whenever I hear an @ArcadeFire song, because I know some artisanal cheese can’t be far away.;;@ArcadeFire;;410638823513538560;https://twitter.com/ConanOBrien/status/410638823513538560
ConanOBrien;2013-12-09 10:11;1730;2014;I’m almost done with my Christmas shopping. Thanks, Burger King!;;;;410109492655706112;https://twitter.com/ConanOBrien/status/410109492655706112
ConanOBrien;2013-12-08 19:57;1855;2364;Phil Collins is making music again. It took him this long to decide which super close-up photo of his face to put on the album cover.;;;;409894604389900288;https://twitter.com/ConanOBrien/status/409894604389900288
ConanOBrien;2013-12-04 10:27;1526;1280;I don't want to say http:// healthcare.gov is still flawed, but my health insurance is now being paid for by a prince in Nigeria.;;;;408301513178488832;https://twitter.com/ConanOBrien/status/408301513178488832
ConanOBrien;2013-12-03 15:39;1838;2158;David Beckham said he was hazed his 1st year as a pro player. For 10 grueling minutes, he was forced to pose for photos with a shirt on.;;;;408017632361590785;https://twitter.com/ConanOBrien/status/408017632361590785
ConanOBrien;2013-12-02 21:52;1383;1331;Amazon drone, wow. Just when I was getting used to the Barnes & Noble surface-to-air book launcher.;;;;407749271874576384;https://twitter.com/ConanOBrien/status/407749271874576384
ConanOBrien;2013-11-30 10:07;1893;1850;You COULD let your guests pile their coats on the bed, but you're just inviting DNA confusion if the night ends in murder.;;;;406846885651947520;https://twitter.com/ConanOBrien/status/406846885651947520
ConanOBrien;2013-11-28 13:16;3342;3543;In honor of Hanukkah falling on Thanksgiving, I am going to spend dinner feeling guilty about everything I have to be thankful for.;;;;406169633331220480;https://twitter.com/ConanOBrien/status/406169633331220480
ConanOBrien;2013-11-27 10:41;2708;2064;Fortunately, gobble gobble" is turkey for "I'm ready, Jesus."";;;;405768236160909312;https://twitter.com/ConanOBrien/status/405768236160909312
ConanOBrien;2013-11-25 11:15;1206;1055;Fun fact: the 1st Thanksgiving had lobster, venison and small pox.;;;;405052015056674816;https://twitter.com/ConanOBrien/status/405052015056674816
ConanOBrien;2013-11-22 19:28;1517;1426;R2D2 has been confirmed for the next #StarWars film. After all these years, R1D1 still can't catch a break.;;;#StarWars;404088936772812801;https://twitter.com/ConanOBrien/status/404088936772812801
ConanOBrien;2013-11-19 13:39;4292;2490;This Rob Ford guy is proof that you can get pretty far just on looks and charm.;;;;402914077199962112;https://twitter.com/ConanOBrien/status/402914077199962112
ConanOBrien;2013-11-15 19:22;1111;1621;Starting a Twitter feud with @Pontifex .  Hey, Pope Francis!  I admire and respect you!  (Not good at Twitter feuds.);;@Pontifex;;401550874008223744;https://twitter.com/ConanOBrien/status/401550874008223744
ConanOBrien;2013-11-13 18:50;1247;1125;Bill Clinton said in terms of Americans keeping their health policy, President Obama should keep his vow." Then he laughed for 9 hours.";;;;400818050145873920;https://twitter.com/ConanOBrien/status/400818050145873920
ConanOBrien;2013-11-10 22:21;2824;2885;Blockbuster announced they’re closing all their stores. Now where am I supposed to go when I want to be alone?;;;;399784007866400768;https://twitter.com/ConanOBrien/status/399784007866400768
ConanOBrien;2013-11-07 22:51;1423;1284;Enjoy the Twitter IPO, nerds. I'll be at the Myspace yardsale.;;;;398704427785129984;https://twitter.com/ConanOBrien/status/398704427785129984
ConanOBrien;2013-11-06 17:51;2298;2014;Is it wrong to drive out to a farm 3 weeks early just to taunt your Thanksgiving turkey?;;;;398266456497848320;https://twitter.com/ConanOBrien/status/398266456497848320
ConanOBrien;2013-10-31 21:29;1100;1115;I don’t like to be wasteful so I’m turning all my leftover Halloween candy corn into a chowder.;;;;396131830333579264;https://twitter.com/ConanOBrien/status/396131830333579264
ConanOBrien;2013-10-30 23:27;572;1013;Celebrating 20 years on television. That’s over two decades of old people not understanding my show: http:// bit.ly/1d4NncN #Conan20;;;#Conan20;395799047673364480;https://twitter.com/ConanOBrien/status/395799047673364480
ConanOBrien;2013-10-26 20:42;2249;1715;I wonder if a shipment of cumberbunds is called a Cumberbatch.;;;;394308198720491523;https://twitter.com/ConanOBrien/status/394308198720491523
ConanOBrien;2013-10-20 18:50;1544;839;Brazil is exhuming the bodies of two former presidents. Man, how bad is Brazil’s current president doing?;;;;392105626035187712;https://twitter.com/ConanOBrien/status/392105626035187712
ConanOBrien;2013-10-14 21:24;1451;1246;Anyone else watch “Jeopardy” shirtless with face paint?;;;;389969893442846721;https://twitter.com/ConanOBrien/status/389969893442846721
ConanOBrien;2013-10-12 15:15;1617;1282;Party going on too long? Go up to your guests and whisper, “I hope you’ll stay for my dream journal reading.”;;;;389152485140492288;https://twitter.com/ConanOBrien/status/389152485140492288
ConanOBrien;2013-10-11 21:48;1122;1210;I just got kicked out of the Museum of Tolerance.;;;;388888963563270144;https://twitter.com/ConanOBrien/status/388888963563270144
ConanOBrien;2013-10-10 11:47;997;1022;Wife not buying that government shutdown includes all gyms.;;;;388375216864260096;https://twitter.com/ConanOBrien/status/388375216864260096
ConanOBrien;2013-10-07 16:20;1607;1201;Just saw Gravity in 3D. Can’t believe all that happened because someone downloaded iO7 on an iPhone 4.;;;;387356803618439171;https://twitter.com/ConanOBrien/status/387356803618439171
ConanOBrien;2013-10-05 13:57;1138;1620;Over 9 million Twitter followers. 1 million more and the empty feeling goes away, right?;;;;386595977643061249;https://twitter.com/ConanOBrien/status/386595977643061249
ConanOBrien;2013-10-01 18:59;2659;1217;Halloween is just a month away, and I still haven’t picked out my excuse for not dressing up.;;;;385222500239417345;https://twitter.com/ConanOBrien/status/385222500239417345
ConanOBrien;2013-09-30 17:49;6820;2793;Obamacare begins tomorrow, and you know what that means! Wait, actually, no, you probably don't know what that means.;;;;384842421181239296;https://twitter.com/ConanOBrien/status/384842421181239296
ConanOBrien;2013-09-29 19:29;6436;3563;Anyone else thought of chaining Vince Gilligan in a barn to make him come up with another show?;;;;384505259952861184;https://twitter.com/ConanOBrien/status/384505259952861184
ConanOBrien;2013-09-27 19:23;2209;1434;Why can’t they make meth with fluoride?;;;;383778984669892610;https://twitter.com/ConanOBrien/status/383778984669892610
ConanOBrien;2013-09-23 16:47;1391;1441;The cast of @BreakingBad_AMC is on tonight. I haven't been this excited since I reunited the original cast of Suite Life of Zack & Cody".";;@BreakingBad_AMC;;382290250573164544;https://twitter.com/ConanOBrien/status/382290250573164544
ConanOBrien;2013-09-23 11:22;2529;1557;I have the entire cast of @BreakingBad_AMC on #CONAN tonight. Many secrets will be revealed. Miss it and you're a fool.;;@BreakingBad_AMC;#CONAN;382208458180657152;https://twitter.com/ConanOBrien/status/382208458180657152
ConanOBrien;2013-09-21 19:07;3068;2506;iOS7? More like iOSHeaven. #ApplePleaseSendMeAniPad;;;#ApplePleaseSendMeAniPad;381600490829533184;https://twitter.com/ConanOBrien/status/381600490829533184
ConanOBrien;2013-09-18 21:15;2361;1907;The new Grand Theft Auto has already made 800 million dollars? Starting tomorrow, I start murdering my guests.;;;;380545724045201408;https://twitter.com/ConanOBrien/status/380545724045201408
ConanOBrien;2013-09-15 10:34;4731;2846;I’m torn because I love the new iPhone5S’s fingerprint scanner, but I also want to get away with some murders.;;;;379297089097707520;https://twitter.com/ConanOBrien/status/379297089097707520
ConanOBrien;2013-09-14 14:47;1333;847;Today is Yom Kippur, the Jewish Day of Atonement, the day when Jews around the world ask for forgiveness for Anthony Weiner.;;;;378998345160609792;https://twitter.com/ConanOBrien/status/378998345160609792
ConanOBrien;2013-09-13 15:52;1261;1665;20 years ago today I made my TV debut. I offered the tapes to The Smithsonian, and they said to leave them out by the recycling bins.;;;;378652479035961344;https://twitter.com/ConanOBrien/status/378652479035961344
ConanOBrien;2013-09-11 09:57;1004;1585;I love when my kids bring me breakfast in bed while dressed as the little girls in “The Shining”.;;;;377838322673909760;https://twitter.com/ConanOBrien/status/377838322673909760
ConanOBrien;2013-09-10 16:20;1377;1448;Trust me, when I say, “Jump!”, my employees say, “That’s a good Van Halen song.”;;;;377572366005448704;https://twitter.com/ConanOBrien/status/377572366005448704
ConanOBrien;2013-09-08 21:01;3307;1770;The new “Madden NFL 25” lets you control a player's career over several seasons. I got it just so I could keep repeatedly firing Tim Tebow.;;;;376918370756468736;https://twitter.com/ConanOBrien/status/376918370756468736
ConanOBrien;2013-09-06 17:39;2558;1208;Watched the Bronco game last night. Nice to finally see NFL guys wearing orange that aren’t jumpsuits.;;;;376142563276640256;https://twitter.com/ConanOBrien/status/376142563276640256
ConanOBrien;2013-09-04 12:19;1974;1543;Orange is The New Black" is proof that I wouldn't survive five minutes in a minimum security women's correctional facility.";;;;375337437003669505;https://twitter.com/ConanOBrien/status/375337437003669505
ConanOBrien;2013-09-03 21:31;2944;1582;I dread the inevitable video where old people are twerking. You know it's coming.;;;;375113833288695808;https://twitter.com/ConanOBrien/status/375113833288695808
ConanOBrien;2013-09-02 14:11;2454;1694;Talked to the guy in charge of milk expiration dates. He said he just uses relatives’ birthdays.;;;;374640749431648256;https://twitter.com/ConanOBrien/status/374640749431648256
ConanOBrien;2013-09-01 21:53;3326;2169;Happy birthday to Turkish footballer Hakan Şükür! #didntevenneedwikipedia;;;#didntevenneedwikipedia;374394562690555906;https://twitter.com/ConanOBrien/status/374394562690555906
ConanOBrien;2013-08-26 17:09;3083;2196;I understand Miley’s VMA performance. I’ve missed dozens of NFL games because my foam hand and I never made it out of the bedroom.;;;;372148776405716992;https://twitter.com/ConanOBrien/status/372148776405716992
